{
  "event_id": "evt-valid-001",
  "event_type": "market.reference",
  "schema_version": "1.0.0",
  "occurred_at": "2026-05-26T15:00:00Z",
  "source": {
    "name": "Official Reference Source",
    "category": "allowed",
    "retrieved_at": "2026-05-26T15:05:00Z",
    "url": "https://example.com/source"
  },
  "asset": {
    "symbol": "AMXL",
    "market": "BMV",
    "currency": "MXN"
  },
  "payload": {
    "note": "Valid foundation sample for schema compatibility."
  }
}
